{
  "changes_problem": false,
  "error_certificate_id": "m2-011-m6-live-diagnosis",
  "generator_id": "live-generator",
  "operation": "replace",
  "patch_id": "m2-011-m6-live-patch-1",
  "rationale": "将所需的代数计算与整数性明确写入结论节点，从节点 1 可直接推出该结论。",
  "replacement_nodes": [
    {
      "claim": "由 x=2m+1，y=2n+1，得 x+y=2m+1+2n+1=2(m+n+1)。又因 m,n 为整数，m+n+1 为整数，所以 x+y 是偶数。",
      "depends_on": [
        {
          "node_id": 1,
          "proof_id": "m2-011",
          "version": 1
        }
      ],
      "node_id": 2,
      "node_type": "conclusion",
      "order_key": 20,
      "self_contained_claim": "由 x=2m+1，y=2n+1，得 x+y=2(m+n+1)；且 m+n+1 为整数，所以 x+y 是偶数。"
    }
  ],
  "schema_version": "0.1",
  "target": {
    "node_id": 2,
    "proof_id": "m2-011",
    "version": 1
  },
  "target_dependencies_after": [
    {
      "node_id": 1,
      "proof_id": "m2-011",
      "version": 1
    }
  ],
  "used_dependencies": [
    {
      "node_id": 1,
      "proof_id": "m2-011",
      "version": 1
    }
  ]
}
