{
  "changes_problem": false,
  "error_certificate_id": "m2-013-m6-live-diagnosis",
  "generator_id": "live-generator",
  "operation": "replace",
  "patch_id": "m2-013-patch-1",
  "rationale": "结合全局假设 x≠0 排除平方等于零的情形，从而可由 x^2≥0 得到 x^2>0。",
  "replacement_nodes": [
    {
      "claim": "由实数平方非负且全局假设 x≠0，得 x^2>0。",
      "depends_on": [
        {
          "node_id": 1,
          "proof_id": "m2-013",
          "version": 1
        }
      ],
      "node_id": 2,
      "node_type": "conclusion",
      "order_key": 20,
      "self_contained_claim": "由实数平方非负且 x≠0，得 x^2>0。"
    }
  ],
  "schema_version": "0.1",
  "target": {
    "node_id": 2,
    "proof_id": "m2-013",
    "version": 1
  },
  "target_dependencies_after": [
    {
      "node_id": 1,
      "proof_id": "m2-013",
      "version": 1
    }
  ],
  "used_dependencies": [
    {
      "node_id": 1,
      "proof_id": "m2-013",
      "version": 1
    }
  ]
}
