{
  "changes_problem": false,
  "error_certificate_id": "m2-018-human-gap-node-2-v1",
  "generator_id": "live-generator",
  "operation": "replace",
  "patch_id": "m2-018-repair-node-2-v1",
  "rationale": "将结论改为明确使用等式代换的推导，避免把等式两边乘以不同因子而未作说明。",
  "replacement_nodes": [
    {
      "claim": "由 x=y，等式两边同乘 x 得 x^2=xy；又由 x=y，得 xy=y^2，因此 x^2=y^2。",
      "depends_on": [],
      "node_id": 2,
      "node_type": "conclusion",
      "order_key": 20,
      "self_contained_claim": "由 x=y，等式两边同乘 x 得 x^2=xy；又由 x=y，得 xy=y^2，因此 x^2=y^2。"
    }
  ],
  "schema_version": "0.1",
  "target": {
    "node_id": 2,
    "proof_id": "m2-018",
    "version": 1
  },
  "target_dependencies_after": [],
  "used_dependencies": []
}
